{
  "$schema": "https://json-schema.org/draft/2020-12/schema",
  "$id": "https://xuhuanstudio.github.io/codex-styler/schema/theme-v1.json",
  "title": "Codex Styler Theme v1",
  "type": "object",
  "additionalProperties": false,
  "required": [
    "format",
    "id",
    "version",
    "metadata",
    "compatibility",
    "variants",
    "scene",
    "assets",
    "locales"
  ],
  "properties": {
    "format": { "const": "codex-styler-theme-v1" },
    "id": {
      "type": "string",
      "pattern": "^[a-z0-9][a-z0-9.-]{2,63}$"
    },
    "version": {
      "type": "string",
      "pattern": "^[0-9]+\\.[0-9]+\\.[0-9]+(?:-[0-9A-Za-z.-]+)?$"
    },
    "metadata": {
      "type": "object",
      "additionalProperties": false,
      "required": ["name", "description", "author", "license", "tags"],
      "properties": {
        "name": { "type": "string", "minLength": 1, "maxLength": 64 },
        "description": { "type": "string", "minLength": 1, "maxLength": 240 },
        "author": { "type": "string", "minLength": 1, "maxLength": 80 },
        "license": { "type": "string", "minLength": 1, "maxLength": 64 },
        "tags": {
          "type": "array",
          "maxItems": 12,
          "uniqueItems": true,
          "items": { "type": "string", "minLength": 1, "maxLength": 32 }
        },
        "homepage": { "type": "string", "format": "uri", "maxLength": 240 },
        "preview": { "$ref": "#/$defs/assetPath" }
      }
    },
    "compatibility": {
      "type": "object",
      "additionalProperties": false,
      "required": ["styler", "codex"],
      "properties": {
        "styler": {
          "type": "object",
          "additionalProperties": false,
          "required": ["minimumVersion"],
          "properties": {
            "minimumVersion": {
              "type": "string",
              "pattern": "^[0-9]+\\.[0-9]+\\.[0-9]+"
            }
          }
        },
        "codex": {
          "type": "object",
          "additionalProperties": false,
          "required": ["mode", "testedVersions"],
          "properties": {
            "mode": { "enum": ["safe", "semantic"] },
            "testedVersions": {
              "type": "array",
              "maxItems": 32,
              "items": { "type": "string", "minLength": 1, "maxLength": 40 }
            }
          }
        }
      }
    },
    "variants": {
      "type": "object",
      "additionalProperties": false,
      "required": ["light", "dark"],
      "properties": {
        "light": { "$ref": "#/$defs/variant" },
        "dark": { "$ref": "#/$defs/variant" }
      }
    },
    "scene": {
      "type": "object",
      "additionalProperties": false,
      "required": ["layers", "entities"],
      "properties": {
        "layers": {
          "type": "array",
          "maxItems": 8,
          "items": { "$ref": "#/$defs/layer" }
        },
        "entities": {
          "type": "array",
          "maxItems": 1,
          "items": { "$ref": "#/$defs/entity" }
        }
      }
    },
    "assets": {
      "type": "array",
      "maxItems": 32,
      "items": { "$ref": "#/$defs/asset" }
    },
    "locales": {
      "type": "object",
      "additionalProperties": {
        "type": "object",
        "additionalProperties": false,
        "required": ["name", "description"],
        "properties": {
          "name": { "type": "string", "minLength": 1, "maxLength": 64 },
          "description": { "type": "string", "minLength": 1, "maxLength": 240 }
        }
      }
    }
  },
  "$defs": {
    "assetPath": {
      "type": "string",
      "pattern": "^(assets|previews)/[A-Za-z0-9._/-]+$",
      "maxLength": 180
    },
    "color": {
      "type": "string",
      "pattern": "^#[0-9A-Fa-f]{6}$"
    },
    "variant": {
      "type": "object",
      "additionalProperties": false,
      "required": ["background", "appearance", "motion"],
      "properties": {
        "background": {
          "type": "object",
          "additionalProperties": false,
          "required": [
            "color",
            "position",
            "brightness",
            "blur",
            "overlay",
            "overlayOpacity"
          ],
          "properties": {
            "color": { "$ref": "#/$defs/color" },
            "image": { "$ref": "#/$defs/assetPath" },
            "position": {
              "type": "object",
              "additionalProperties": false,
              "required": ["x", "y"],
              "properties": {
                "x": { "type": "number", "minimum": 0, "maximum": 100 },
                "y": { "type": "number", "minimum": 0, "maximum": 100 }
              }
            },
            "brightness": { "type": "number", "minimum": 0.2, "maximum": 2 },
            "blur": { "type": "number", "minimum": 0, "maximum": 40 },
            "overlay": { "$ref": "#/$defs/color" },
            "overlayOpacity": { "type": "number", "minimum": 0, "maximum": 1 }
          }
        },
        "appearance": {
          "type": "object",
          "additionalProperties": false,
          "required": [
            "accent",
            "surface",
            "surfaceOpacity",
            "text",
            "mutedText",
            "border",
            "radius",
            "focusOpacity",
            "focusBlur"
          ],
          "properties": {
            "accent": { "$ref": "#/$defs/color" },
            "surface": { "$ref": "#/$defs/color" },
            "surfaceOpacity": { "type": "number", "minimum": 0, "maximum": 1 },
            "text": { "$ref": "#/$defs/color" },
            "mutedText": { "$ref": "#/$defs/color" },
            "border": { "$ref": "#/$defs/color" },
            "radius": { "type": "number", "minimum": 0, "maximum": 32 },
            "focusOpacity": { "type": "number", "minimum": 0, "maximum": 1 },
            "focusBlur": { "type": "number", "minimum": 0, "maximum": 32 }
          }
        },
        "motion": {
          "type": "object",
          "additionalProperties": false,
          "required": ["intensity", "parallax", "targetFps"],
          "properties": {
            "intensity": { "type": "number", "minimum": 0, "maximum": 1 },
            "parallax": { "type": "number", "minimum": 0, "maximum": 30 },
            "targetFps": { "enum": [24, 30, 60] }
          }
        }
      }
    },
    "layer": {
      "type": "object",
      "additionalProperties": false,
      "required": ["id", "type", "opacity", "blendMode", "parallax"],
      "properties": {
        "id": {
          "type": "string",
          "pattern": "^[a-z0-9][a-z0-9-]{1,39}$"
        },
        "type": { "enum": ["image", "gradient", "vignette"] },
        "asset": { "$ref": "#/$defs/assetPath" },
        "opacity": { "type": "number", "minimum": 0, "maximum": 1 },
        "blendMode": {
          "enum": ["normal", "multiply", "screen", "overlay", "soft-light"]
        },
        "parallax": { "type": "number", "minimum": -30, "maximum": 30 }
      }
    },
    "entity": {
      "type": "object",
      "additionalProperties": false,
      "required": [
        "id",
        "name",
        "renderer",
        "behaviors",
        "anchor",
        "size",
        "opacity"
      ],
      "properties": {
        "id": {
          "type": "string",
          "pattern": "^[a-z0-9][a-z0-9-]{1,39}$"
        },
        "name": { "type": "string", "minLength": 1, "maxLength": 64 },
        "renderer": {
          "oneOf": [
            {
              "type": "object",
              "additionalProperties": false,
              "required": ["type", "asset"],
              "properties": {
                "type": { "const": "image" },
                "asset": { "$ref": "#/$defs/assetPath" }
              }
            },
            {
              "type": "object",
              "additionalProperties": false,
              "required": [
                "type",
                "asset",
                "columns",
                "rows",
                "frameWidth",
                "frameHeight",
                "directions"
              ],
              "properties": {
                "type": { "const": "sprite-atlas" },
                "asset": { "$ref": "#/$defs/assetPath" },
                "columns": { "type": "integer", "minimum": 1, "maximum": 16 },
                "rows": { "type": "integer", "minimum": 1, "maximum": 16 },
                "frameWidth": { "type": "integer", "minimum": 16, "maximum": 1024 },
                "frameHeight": { "type": "integer", "minimum": 16, "maximum": 1024 },
                "directions": { "type": "integer", "enum": [4, 8, 16] }
              }
            }
          ]
        },
        "behaviors": {
          "type": "array",
          "uniqueItems": true,
          "items": {
            "enum": [
              "idle",
              "parallax",
              "look-at-pointer",
              "reduce-motion-fallback"
            ]
          }
        },
        "anchor": {
          "type": "object",
          "additionalProperties": false,
          "required": ["x", "y"],
          "properties": {
            "x": { "type": "number", "minimum": 0, "maximum": 100 },
            "y": { "type": "number", "minimum": 0, "maximum": 100 }
          }
        },
        "size": { "type": "number", "minimum": 24, "maximum": 512 },
        "opacity": { "type": "number", "minimum": 0, "maximum": 1 }
      }
    },
    "asset": {
      "type": "object",
      "additionalProperties": false,
      "required": ["id", "path", "type", "license"],
      "properties": {
        "id": {
          "type": "string",
          "pattern": "^[a-z0-9][a-z0-9-]{1,39}$"
        },
        "path": { "$ref": "#/$defs/assetPath" },
        "type": { "enum": ["background", "sprite-atlas", "preview"] },
        "license": { "type": "string", "minLength": 1, "maxLength": 64 }
      }
    }
  }
}

